{
  "$schema": "https://json-schema.org/draft/2020-12/schema",
  "$id": "https://yana-ai.local/schemas/spec.schema.json",
  "title": "Yana AI Task Spec",
  "description": "Schema for pre-implementation task specifications used by internal Spec Gate checks.",
  "type": "object",
  "required": [
    "schema_version",
    "id",
    "title",
    "goal",
    "scope",
    "acceptance_criteria",
    "verification_plan",
    "owner",
    "created_at"
  ],
  "properties": {
    "schema_version": {
      "type": "string",
      "pattern": "^v[0-9]+\\.[0-9]+$"
    },
    "id": {
      "type": "string",
      "minLength": 3,
      "maxLength": 128,
      "pattern": "^[A-Za-z0-9._:/-]+$"
    },
    "title": {
      "type": "string",
      "minLength": 5,
      "maxLength": 160
    },
    "goal": {
      "type": "string",
      "minLength": 10
    },
    "scope": {
      "type": "object",
      "required": [
        "in_scope",
        "out_of_scope"
      ],
      "properties": {
        "in_scope": {
          "type": "array",
          "minItems": 1,
          "items": {
            "type": "string",
            "minLength": 1
          }
        },
        "out_of_scope": {
          "type": "array",
          "items": {
            "type": "string",
            "minLength": 1
          }
        }
      },
      "additionalProperties": true
    },
    "acceptance_criteria": {
      "type": "array",
      "minItems": 1,
      "items": {
        "type": "string",
        "minLength": 5
      }
    },
    "verification_plan": {
      "type": "array",
      "minItems": 1,
      "items": {
        "type": "object",
        "required": [
          "type",
          "description"
        ],
        "properties": {
          "type": {
            "type": "string",
            "enum": [
              "command",
              "manual-check",
              "artifact-check"
            ]
          },
          "description": {
            "type": "string",
            "minLength": 3
          },
          "command": {
            "type": "string",
            "minLength": 1
          },
          "expected_evidence": {
            "type": "string",
            "minLength": 1
          }
        },
        "additionalProperties": true
      }
    },
    "rollback_plan": {
      "type": "string",
      "minLength": 3
    },
    "risk_level": {
      "type": "string",
      "enum": [
        "L0",
        "L1",
        "L2",
        "L3",
        "L4",
        "L5"
      ]
    },
    "owner": {
      "type": "string",
      "minLength": 2
    },
    "metadata": {
      "type": "object",
      "additionalProperties": true
    },
    "created_at": {
      "type": "string",
      "format": "date-time"
    },
    "updated_at": {
      "type": "string",
      "format": "date-time"
    },
    "notes": {
      "type": "array",
      "items": {
        "type": "string"
      }
    }
  },
  "patternProperties": {
    "^x-[A-Za-z0-9._-]+$": {}
  },
  "additionalProperties": false
}
