{
  "schema_version": "v1.0",
  "id": "task.docs.harness-scaling.review",
  "title": "Review Harness Scaling docs",
  "goal": "Review docs and schemas for consistency before integration.",
  "scope": {
    "in_scope": [
      "docs/architecture/HARNESS_SCALING_LAYERS.md"
    ],
    "out_of_scope": [
      "core/hooks/**"
    ]
  },
  "acceptance_criteria": [
    "Review notes identify schema strictness and vagueness gaps."
  ],
  "verification_plan": [
    {
      "type": "manual-check",
      "description": "Confirm public positioning remains Auditor-first."
    }
  ],
  "owner": "maintainer",
  "created_at": "2026-05-27T12:00:00Z"
}
